{"type":"config","name":"pi-autoresearch smoke test","metricName":"smoke_ms","metricUnit":"ms","bestDirection":"lower"}
{"run":1,"commit":"080d454","metric":1,"metrics":{},"status":"discard","description":"Smoke test run to verify pi-autoresearch init/run/log pipeline in agent-config","timestamp":1778132230929,"segment":0,"confidence":null,"asi":{"hypothesis":"pi-autoresearch extension tools are installed and can initialize, run a command, parse METRIC output, and record a result end-to-end","rollback_reason":"Smoke test only; not a real optimization attempt and should not be kept as a project change","next_action_hint":"Use /skill:autoresearch-create with a real benchmark target next","learned":"Manual install works even though npm global install failed under Nix; core experiment pipeline is functioning"}}
{"type":"config","name":"session-recap latency","metricName":"recap_ms","metricUnit":"ms","bestDirection":"lower"}
{"run":2,"commit":"080d454","metric":38.179,"metrics":{"spread_ms":4.036},"status":"discard","description":"Establish baseline for session-recap latency with 7-sample median harness","timestamp":1778132312021,"segment":1,"confidence":null,"asi":{"hypothesis":"Measure the common session-recap path before code changes using a repeated-run median to reduce noise","rollback_reason":"Baseline only; no optimization change yet","next_action_hint":"Apply a low-risk allocation reduction in extract_messages and re-measure","learned":"Current baseline is ~38.2ms median with ~4.0ms spread on agent-config/pi session recap path"}}
{"run":3,"commit":"3af11d9","metric":35.095,"metrics":{"spread_ms":10.856},"status":"keep","description":"Use a bounded deque in extract_messages so session-recap keeps only the final N messages instead of building and slicing the full list","timestamp":1778132343347,"segment":1,"confidence":null,"asi":{"hypothesis":"For long session files, retaining only the final N messages with deque(maxlen=N) should reduce allocation and copying overhead without changing output semantics","learned":"Median latency improved from 38.179ms to 35.095ms on the common agent-config/pi recap path; variability increased on this sample so the win should be rechecked in a later run","next_action_hint":"Consider a confirmation run or inspect directory scan cost in find_session_files if more speed is needed"}}
{"run":4,"commit":"3af11d9","metric":36.387,"metrics":{"spread_ms":14.037},"status":"discard","description":"Avoid per-line strip before json.loads and lazily allocate text/tool lists during content extraction","timestamp":1778132390257,"segment":1,"confidence":2.3869969040247674,"asi":{"hypothesis":"Removing an extra line copy and skipping empty list allocation for common content shapes might reduce recap parsing overhead","rollback_reason":"This change regressed the primary metric versus the current best kept version (35.095ms → 36.387ms) and increased variability","next_action_hint":"Revert this path and investigate session directory scanning or repeated timestamp formatting instead","learned":"The extra parsing/allocation tweaks were not better than the simpler deque-only improvement on this workload"}}
{"run":5,"commit":"3af11d9","metric":37.487,"metrics":{"spread_ms":4.353},"status":"discard","description":"Switch find_session_files directory walks to os.scandir to test whether DirEntry-based scanning reduces session discovery overhead","timestamp":1778132430301,"segment":1,"confidence":3.4419642857142727,"asi":{"hypothesis":"Directory traversal may dominate the common recap path, and os.scandir could lower filesystem iteration overhead versus Path.iterdir","rollback_reason":"This regressed the primary metric versus the current best kept version (35.095ms → 37.487ms) with no compensating benefit","next_action_hint":"Revert and investigate output formatting costs such as repeated timestamp conversion, or run a confirmation measurement on the kept deque optimization","learned":"On this workload, DirEntry-based scanning did not beat the existing Path-based traversal"}}
{"run":6,"commit":"3af11d9","metric":37.489,"metrics":{"spread_ms":3.864},"status":"discard","description":"Add a dedicated HH:MM:SS timestamp formatter for message rows to avoid formatting full datetimes then splitting on 'T'","timestamp":1778132463971,"segment":1,"confidence":4.456647398843934,"asi":{"hypothesis":"Message-row timestamp formatting may be a small but repeated hot path, so formatting only HH:MM:SS directly could trim per-message string work","rollback_reason":"This did not improve the primary metric versus the current best kept version (35.095ms → 37.489ms), despite slightly lower spread","next_action_hint":"Revert and prefer a confirmation run of the kept deque optimization or a more structural hypothesis backed by profiling","learned":"Micro-optimizing the timestamp formatting path was not worthwhile on this benchmark"}}
{"run":7,"commit":"3af11d9","metric":40.092,"metrics":{"spread_ms":7.471},"status":"discard","description":"Re-run the current kept deque implementation without code changes to confirm the earlier improvement against benchmark noise","timestamp":1778132484718,"segment":1,"confidence":3.441964285714286,"asi":{"hypothesis":"If the deque-based optimization is robust, a no-change confirmation run should stay near the previously observed 35.095ms result","rollback_reason":"Confirmation run was slower than the current best kept result (35.095ms → 40.092ms), so there is no new improvement to keep","next_action_hint":"Treat this workload as noisier than the first keep suggested and either strengthen the benchmark harness or profile before further micro-optimizations","learned":"The same code measured materially slower on this confirmation run, indicating substantial benchmark noise or environmental variance on this path"}}
{"run":8,"commit":"3af11d9","metric":38.043,"metrics":{"spread_ms":6.174},"status":"discard","description":"Bound session discovery to the needed newest files using a small heap instead of always collecting and fully sorting all matching session JSONLs","timestamp":1778132519529,"segment":1,"confidence":4.469565217391278,"asi":{"hypothesis":"The common recap path only needs skip+sessions newest files, so keeping only a bounded top-K set during discovery may reduce unnecessary sorting work","rollback_reason":"This did not beat the current best kept implementation (35.095ms → 38.043ms) and was only roughly baseline-level","next_action_hint":"Revert this optimization attempt and consider improving benchmark stability before pursuing more micro-optimizations","learned":"Session file sorting was not the dominant cost for this workload; top-K bounding did not translate into end-to-end speedup"}}
{"run":9,"commit":"7fa6a4e","metric":34.888,"metrics":{"spread_ms":3.822},"status":"keep","description":"Replace regex-heavy project extraction with simple string splitting in _extract_project for the common session directory naming patterns","timestamp":1778132568365,"segment":1,"confidence":3.6729910714285725,"asi":{"hypothesis":"Session discovery calls _extract_project for many directories, so replacing multiple regex matches with direct prefix checks and split operations should cut overhead without changing recognized path patterns","learned":"Median latency improved from the previous best 35.095ms to 34.888ms while also reducing spread to 3.822ms on this benchmark","next_action_hint":"Clean up the now-unused re import and consider another confirmation run before pursuing smaller micro-optimizations"}}
{"run":10,"commit":"7fa6a4e","metric":36.944,"metrics":{"spread_ms":6.306},"status":"discard","description":"Re-run the current best implementation to check whether the string-splitting _extract_project improvement reproduces under benchmark noise","timestamp":1778132585780,"segment":1,"confidence":4.7557803468208135,"asi":{"hypothesis":"If the regex-to-split project extraction change is robust, a no-change confirmation run should stay near the kept 34.888ms result","rollback_reason":"Confirmation run was slower than the current best kept result (34.888ms → 36.944ms), so there is no new improvement to keep","next_action_hint":"Benchmark remains noisy; prefer stronger harness stabilization or profiling-guided changes over more tiny micro-optimizations","learned":"The kept implementation still beats baseline, but this confirmation run shows noticeable variance, so future conclusions should rely on sturdier measurement"}}
